{
  "version": 1,
  "revision": "2026-10-02.1",
  "redistribution": "Paraphrased public facts and attribution only; no upstream code, manuals, vendor assets or private capture identifiers. Source license metadata is advisory and requires review before reuse. No project license selected.",
  "aliases": [
    {
      "from": "microbit-led-service",
      "to": "microbit-led"
    },
    {
      "from": "divoom-classic-candidate",
      "to": "divoom-classic"
    },
    {
      "from": "coolledux",
      "to": "coolledux-advanced"
    },
    {
      "from": "coolledx",
      "to": "coolledx-simple"
    },
    {
      "from": "idotmatrix",
      "to": "idotmatrix-length16"
    },
    {
      "from": "bk-light",
      "to": "bk-png"
    }
  ],
  "families": [
    {
      "id": "aa55-gif",
      "label": "AA55FFFF GIF transfer candidate cluster",
      "sheetId": "aa55-gif",
      "resolution": "documented-line",
      "unknowns": [
        "CONSTSEQmeaning",
        "0x81c4meaning",
        "fragmentlengthfieldgenerality",
        "exactchip",
        "Nyangeometryconflict",
        "powercyclepersistence"
      ],
      "match": null
    },
    {
      "id": "aes-ascii-badge",
      "label": "AES ASCII command badge",
      "sheetId": "aes-ascii-badge",
      "resolution": "documented-line",
      "unknowns": [
        "panelgeometry",
        "MCU",
        "vendorappID",
        "persistence",
        "hardwarelimits",
        "broadbadgecompatibility"
      ],
      "match": null
    },
    {
      "id": "b1248-hid",
      "label": "b1248 hid",
      "sheetId": null,
      "resolution": "unresolved",
      "unknowns": ["Family applicability unresolved; reference index only."],
      "match": null
    },
    {
      "id": "badge-oem-unresolved",
      "label": "badge oem unresolved",
      "sheetId": null,
      "resolution": "unresolved",
      "unknowns": ["Family applicability unresolved; reference index only."],
      "match": null
    },
    {
      "id": "badgemagic-nextgen",
      "label": "Badge Magic open next-gen profile",
      "sheetId": "badgemagic-nextgen",
      "resolution": "documented-line",
      "unknowns": [
        "legacyOEMcompatibility beyonddocumented path",
        "actualnegotiatedMTU/writefragmentation",
        "allconfigurationerrorsemantics"
      ],
      "match": null
    },
    {
      "id": "bk-png",
      "label": "BK-LightPNG",
      "sheetId": "bk-png",
      "resolution": "documented-line",
      "unknowns": [
        "exactcontroller/chip",
        "universalmodelcoverage",
        "powercycledurability",
        "newhardwarevalidation"
      ],
      "match": {
        "serviceUuid": null,
        "characteristicUuids": [
          "0000fa02-0000-1000-8000-00805f9b34fb",
          "0000fa03-0000-1000-8000-00805f9b34fb"
        ],
        "assertionId": "seed:bk.gatt"
      }
    },
    {
      "id": "bluefruit-uart-example",
      "label": "Adafruit EyeLights Bluetooth message scroller",
      "sheetId": "bluefruit-uart-example",
      "resolution": "documented-line",
      "unknowns": [
        "exactUARTUUIDsinthisexample",
        "controllerchecksumformat",
        "persistence",
        "firmwareversion",
        "18×5vs16×5wording"
      ],
      "match": null
    },
    {
      "id": "chemion-unresolved",
      "label": "chemion unresolved",
      "sheetId": null,
      "resolution": "unresolved",
      "unknowns": ["Family applicability unresolved; reference index only."],
      "match": null
    },
    {
      "id": "color-chemion-unresolved",
      "label": "color chemion unresolved",
      "sheetId": null,
      "resolution": "unresolved",
      "unknowns": ["Family applicability unresolved; reference index only."],
      "match": null
    },
    {
      "id": "coolledux-advanced",
      "label": "CoolLEDUX advanced",
      "sheetId": "coolledux-advanced",
      "resolution": "documented-line",
      "unknowns": [
        "exactcontroller/chip",
        "universalmodelcoverage",
        "powercycledurability",
        "newhardwarevalidation"
      ],
      "match": {
        "serviceUuid": "0000fff0-0000-1000-8000-00805f9b34fb",
        "characteristicUuids": ["0000fff1-0000-1000-8000-00805f9b34fb"],
        "assertionId": "seed:ux.gatt"
      }
    },
    {
      "id": "coolledx-simple",
      "label": "Classic CoolLEDX",
      "sheetId": "coolledx-simple",
      "resolution": "documented-line",
      "unknowns": [
        "exactcontroller/chip",
        "universalmodelcoverage",
        "powercycledurability",
        "newhardwarevalidation"
      ],
      "match": {
        "serviceUuid": "0000fff0-0000-1000-8000-00805f9b34fb",
        "characteristicUuids": ["0000fff1-0000-1000-8000-00805f9b34fb"],
        "assertionId": "seed:x.gatt"
      }
    },
    {
      "id": "divoom-classic",
      "label": "Divoom Classic/SPP TimeboxEvo",
      "sheetId": "divoom-classic",
      "resolution": "documented-line",
      "unknowns": [
        "specificfirmwaregeneration",
        "BLEvariantcompatibility",
        "samechannelacrossmodelnames",
        "powercycledurability",
        "truepalettecapacitybydevice"
      ],
      "match": null
    },
    {
      "id": "divoom-generation-unresolved",
      "label": "divoom generation unresolved",
      "sheetId": null,
      "resolution": "unresolved",
      "unknowns": ["Family applicability unresolved; reference index only."],
      "match": null
    },
    {
      "id": "divoom-http",
      "label": "divoom http",
      "sheetId": null,
      "resolution": "unresolved",
      "unknowns": ["Family applicability unresolved; reference index only."],
      "match": null
    },
    {
      "id": "divoom-modern-ble",
      "label": "DivoommodernBLE",
      "sheetId": "divoom-modern-ble",
      "resolution": "documented-line",
      "unknowns": [
        "exactcontroller/chip",
        "universalmodelcoverage",
        "powercycledurability",
        "newhardwarevalidation"
      ],
      "match": {
        "serviceUuid": "49535343-fe7d-4ae5-8fa9-9fafd205e455",
        "characteristicUuids": [
          "49535343-8841-43f4-a8d4-ecbe34729bb3",
          "49535343-1e4d-4bd9-ba61-23c647249616"
        ],
        "assertionId": "seed:dv.gatt"
      }
    },
    {
      "id": "divoom-spp-lcd",
      "label": "divoom spp lcd",
      "sheetId": null,
      "resolution": "unresolved",
      "unknowns": ["Family applicability unresolved; reference index only."],
      "match": null
    },
    {
      "id": "dotti",
      "label": "Witti Dotti",
      "sheetId": "dotti",
      "resolution": "documented-line",
      "unknowns": [
        "serviceUUID/properties",
        "notifications",
        "frame-levelprotocol",
        "firmwarecoverage",
        "iconpowercycledurability",
        "modernOSstatus"
      ],
      "match": null
    },
    {
      "id": "firmware-dependent",
      "label": "firmware dependent",
      "sheetId": null,
      "resolution": "unresolved",
      "unknowns": ["Family applicability unresolved; reference index only."],
      "match": null
    },
    {
      "id": "fitpro-cd-candidate",
      "label": "DG01 / SuperBand / FitPro candidate (adjacentLCD)",
      "sheetId": "fitpro-cd-candidate",
      "resolution": "documented-line",
      "unknowns": [
        "actualbulkcharacteristic",
        "successfulimageuploadphysicalreport",
        "SoC",
        "fullfileprotocol",
        "firmwaredependence"
      ],
      "match": null
    },
    {
      "id": "govee-unresolved",
      "label": "govee unresolved",
      "sheetId": null,
      "resolution": "unresolved",
      "unknowns": ["Family applicability unresolved; reference index only."],
      "match": null
    },
    {
      "id": "ideal-aes",
      "label": "ideal aes",
      "sheetId": null,
      "resolution": "unresolved",
      "unknowns": ["Family applicability unresolved; reference index only."],
      "match": null
    },
    {
      "id": "idotmatrix-length16",
      "label": "iDotMatrix",
      "sheetId": "idotmatrix-length16",
      "resolution": "documented-line",
      "unknowns": [
        "exactcontroller/chip",
        "universalmodelcoverage",
        "powercycledurability",
        "newhardwarevalidation"
      ],
      "match": {
        "serviceUuid": "000000fa-0000-1000-8000-00805f9b34fb",
        "characteristicUuids": [
          "0000fa02-0000-1000-8000-00805f9b34fb",
          "0000fa03-0000-1000-8000-00805f9b34fb"
        ],
        "assertionId": "seed:idot.gatt"
      }
    },
    {
      "id": "ipixel-length16",
      "label": "iPIXEL Color length16/command16",
      "sheetId": "ipixel-length16",
      "resolution": "documented-line",
      "unknowns": [
        "filechunkingvsATTwrites",
        "chip",
        "modelspecificpasswordrequirements",
        "timing",
        "generationrelationtoBKandIDM",
        "standaloneread-onlydeviceinfo"
      ],
      "match": null
    },
    {
      "id": "ipixel-raw-stream-candidate",
      "label": "B.K.Light64×16 rawRGB stream",
      "sheetId": "ipixel-raw-stream-candidate",
      "resolution": "documented-line",
      "unknowns": [
        "serviceUUID",
        "GATTproperties",
        "actualACTmodel",
        "whyrawvsPNGpaths",
        "durability",
        "ACKcorrelation"
      ],
      "match": null
    },
    {
      "id": "jieli-rcsp-e87",
      "label": "E87/L8 RCSP fileupload (adjacentLCD)",
      "sheetId": "jieli-rcsp-e87",
      "resolution": "documented-line",
      "unknowns": [
        "filemetadata4bytetokensemantics",
        "allreselleraliases",
        "SoCdie",
        "GIFbeyondJPEG",
        "durability",
        "authbinarylicenseorigin"
      ],
      "match": null
    },
    {
      "id": "kano-unresolved",
      "label": "kano unresolved",
      "sheetId": null,
      "resolution": "unresolved",
      "unknowns": ["Family applicability unresolved; reference index only."],
      "match": null
    },
    {
      "id": "lametric-http",